place_name,place_category,rating,review_date,review_text,city_target,
Malecón de Puerto Vallarta,atracción,2,15/03/2023,"La visita a Malecón de Puerto Vallarta me dejó dudas. La visita se sintió más floja de lo que imaginaba. Encima, el tema de la atención necesita mejorar. Fuimos en familia de noche. Conviene ir con tiempo y sin prisa. Con varios cambios podría mejorar, pero hoy no lo recomendaría. La fama del lugar me hizo esperar bastante más.","Puerto Vallarta, Jalisco, México",
Resort frente a la playa,hotel,5,12/04/2023,"De lo mejor del viaje fue Resort frente a la playa. El check-in fue rápido y amable. Además, para mí, el tema de la ubicación marcó una diferencia positiva. Fuimos con niños un domingo. Con calor fuerte conviene llevar agua y bloqueador. Es una parada muy recomendable. Incluso con gente, se pudo disfrutar bastante.","Puerto Vallarta, Jalisco, México",
Playa Conchas Chinas,playa,5,02/01/2024,"Quedé fascinado con Playa Conchas Chinas. Se podía pasar un buen rato sin prisa. Además, para mí, el tema de la vista me dejó muy buena impresión. Fuimos con niños por la mañana. Nos movimos a pie sin complicarnos. Lo volvería a incluir en otro viaje. Nos quedamos con ganas de volver con más tiempo.","Puerto Vallarta, Jalisco, México",
Excursión a las cascadas,tour,5,07/11/2023,"Volvería sin pensarlo a Excursión a las cascadas. La actividad estuvo muy bien llevada. Además, para mí, el tema de la limpieza fue de lo mejor. Fuimos en plan tranquilo al mediodía. Nos movimos a pie sin complicarnos. Definitivamente volvería. Se nota cuando un lugar está bien llevado.","Puerto Vallarta, Jalisco, México",
Restaurante frente al mar en Marina,restaurante,5,07/02/2023,"Excelente visita a Restaurante frente al mar en Marina. Las porciones me parecieron justas. Además, honestamente, el tema de la relación calidad-precio superó lo esperado. Fuimos en familia entre semana. Llegamos al atardecer y la luz ayudó muchísimo. Lo recomiendo sin problema. Todo se sintió bastante cómodo.","Puerto Vallarta, Jalisco, México",
Excursión a las cascadas,tour,4,15/08/2025,"Muy buena experiencia en Excursión a las cascadas. No se sintió apresurado. Además, honestamente, el tema de la atención destacó bastante. Fuimos solo entre semana. Nos movimos a pie sin complicarnos. Lo recomiendo sin problema. Incluso con gente, se pudo disfrutar bastante.","Puerto Vallarta, Jalisco, México",
Zona Romántica,barrio,5,21/02/2025,"Me encantó Zona Romántica. Es de las zonas con más ambiente. Además, en general, el tema de la limpieza superó lo esperado. Fuimos en plan tranquilo al atardecer. Nos movimos a pie sin complicarnos. Lo volvería a incluir en otro viaje. Fue de esas visitas que te dejan buen sabor de boca.","Puerto Vallarta, Jalisco, México",
Mercado de artesanías del Malecón,mercado,4,09/12/2025,"Buena visita a Mercado de artesanías del Malecón. Vale la pena caminarlo con calma. Además, en general, el tema de la tranquilidad fue de lo mejor. Fuimos solo al atardecer. En temporada alta imagino que cambia bastante. Es una parada muy recomendable. Incluso con gente, se pudo disfrutar bastante.","Puerto Vallarta, Jalisco, México",
Paseo en barco por la bahía,tour,5,17/05/2024,"Me encantó Paseo en barco por la bahía. El guía explicó todo con claridad. Además, en general, el tema de la ubicación marcó una diferencia positiva. Fuimos en pareja de noche. Entre semana se siente mucho más llevadero. Vale mucho la pena. Incluso con gente, se pudo disfrutar bastante.","Puerto Vallarta, Jalisco, México",
Playa Colomitos,playa,5,06/09/2024,"Me encantó Playa Colomitos. Se podía pasar un buen rato sin prisa. Además, en general, el tema de la limpieza destacó bastante. Fuimos en familia de noche. En temporada alta imagino que cambia bastante. Lo volvería a incluir en otro viaje. Nos quedamos con ganas de volver con más tiempo.","Puerto Vallarta, Jalisco, México",
Jardín Botánico de Vallarta,jardín,4,13/02/2023,"Valió la pena conocer Jardín Botánico de Vallarta. Nos sorprendió lo bonito del lugar. Además, en general, el tema de la tranquilidad me dejó muy buena impresión. Fuimos solo en vacaciones. Conviene ir con tiempo y sin prisa. Es una parada muy recomendable. Fue de esas visitas que te dejan buen sabor de boca.","Puerto Vallarta, Jalisco, México",
Galería del Centro,galería,3,14/06/2025,"La experiencia en Galería del Centro fue regular. No está mal para una parada breve. Lo mejor fue el ambiente, pero el tema del mantenimiento terminó siendo un problema. Fuimos en plan tranquilo por la mañana. Hay buenos puntos para tomar fotos. Puede gustarte más si eliges bien la hora. No fue perfecto, pero sí tuvo momentos rescatables.","Puerto Vallarta, Jalisco, México",
Playa Conchas Chinas,playa,1,08/08/2025,"Fue una decepción total visitar Playa Conchas Chinas. No estuvo a la altura de lo que prometía. Encima, el tema del tiempo de espera terminó siendo un problema. Fuimos con amigos al atardecer. Con calor fuerte conviene llevar agua y bloqueador. No volvería así como está. La fama del lugar me hizo esperar bastante más.","Puerto Vallarta, Jalisco, México",
Mismaloya,playa,4,23/07/2023,"Valió la pena conocer Mismaloya. Nos tocó una playa bastante disfrutable. Además, honestamente, el tema de la tranquilidad sumó muchísimo. Fuimos en familia al atardecer. Con calor fuerte conviene llevar agua y bloqueador. Sí regresaría. Fue de esas visitas que te dejan buen sabor de boca.","Puerto Vallarta, Jalisco, México",
Playa Mismaloya,playa,4,27/01/2024,"Buena visita a Playa Mismaloya. Nos tocó una playa bastante disfrutable. Además, honestamente, el tema del ambiente fue de lo mejor. Fuimos en plan tranquilo un domingo. El clima nos tocó a favor y eso mejoró todo. Definitivamente volvería. Todo se sintió bastante cómodo.","Puerto Vallarta, Jalisco, México",
Bar con terraza en el Malecón,bar,5,07/01/2023,"Volvería sin pensarlo a Bar con terraza en el Malecón. La música acompañó sin molestar. Además, honestamente, el tema de la ubicación fue de lo mejor. Fuimos con niños de noche. Conviene ir con tiempo y sin prisa. Lo recomiendo sin problema. Todo se sintió bastante cómodo.","Puerto Vallarta, Jalisco, México",
Parque Lázaro Cárdenas,parque,5,08/03/2023,"Volvería sin pensarlo a Parque Lázaro Cárdenas. Tiene ambiente familiar. Además, para mí, el tema de la limpieza estuvo muy bien. Fuimos con amigos de noche. Hay buenos puntos para tomar fotos. Sí regresaría. Fue de esas visitas que te dejan buen sabor de boca.","Puerto Vallarta, Jalisco, México",
Muelle de Los Muertos,atracción,3,21/05/2023,"Mi visita a Muelle de Los Muertos estuvo bien, sin más. Se deja conocer, pero esperaba algo más. Lo mejor fue la organización, pero el tema de la atención se notó bastante. Fuimos en pareja al atardecer. Conviene ir con tiempo y sin prisa. Tiene potencial si cuidan algunos detalles. La experiencia depende bastante del momento del día.","Puerto Vallarta, Jalisco, México",
Playa Colomitos,playa,5,12/12/2025,"Excelente visita a Playa Colomitos. Se podía pasar un buen rato sin prisa. Además, la verdad, el tema del ambiente destacó bastante. Fuimos con amigos por la mañana. Fuimos temprano y se disfrutó más. Lo recomiendo sin problema. Incluso con gente, se pudo disfrutar bastante.","Puerto Vallarta, Jalisco, México",
Hotel boutique en Zona Romántica,hotel,3,05/07/2025,"La vuelta por Hotel boutique en Zona Romántica fue bastante normal. La estancia fue correcta, sin más. Lo mejor fue la ubicación, pero el tema de la saturación de gente fue lo más flojo. Fuimos con mis papás al atardecer. Con calor fuerte conviene llevar agua y bloqueador. Tiene potencial si cuidan algunos detalles. Hay detalles que cambian bastante según la hora.","Puerto Vallarta, Jalisco, México",
Los Arcos de Mismaloya,tour,4,19/03/2026,"Salimos contentos de Los Arcos de Mismaloya. La logística salió mejor de lo esperado. Además, en general, el tema de la organización destacó bastante. Fuimos con mis papás en vacaciones. Con calor fuerte conviene llevar agua y bloqueador. Lo recomiendo sin problema. Todo se sintió bastante cómodo.","Puerto Vallarta, Jalisco, México",
Bar con terraza en el Malecón,bar,4,18/01/2025,"Salimos contentos de Bar con terraza en el Malecón. La música acompañó sin molestar. Además, honestamente, el tema del ambiente superó lo esperado. Fuimos con amigos al atardecer. El clima nos tocó a favor y eso mejoró todo. Lo volvería a incluir en otro viaje. Todo se sintió bastante cómodo.","Puerto Vallarta, Jalisco, México",
Playa Gemelas,playa,5,17/02/2025,"Volvería sin pensarlo a Playa Gemelas. La arena estaba mejor de lo que esperaba. Además, honestamente, el tema del ambiente fue de lo mejor. Fuimos en pareja al mediodía. El clima nos tocó a favor y eso mejoró todo. Lo volvería a incluir en otro viaje. Fue de esas visitas que te dejan buen sabor de boca.","Puerto Vallarta, Jalisco, México",
Marina Vallarta,paseo,1,16/05/2024,"Salí muy inconforme de Marina Vallarta. No pude caminarlo con la calma que esperaba. Encima, el tema de la señalización necesita mejorar. Fuimos en familia al mediodía. Conviene ir con tiempo y sin prisa. Con varios cambios podría mejorar, pero hoy no lo recomendaría. Me fui con la sensación de que pudo estar mucho mejor.","Puerto Vallarta, Jalisco, México",
Hotel boutique en Zona Romántica,hotel,3,13/10/2025,"La vuelta por Hotel boutique en Zona Romántica fue bastante normal. Cumple para dormir, pero no destaca. Lo mejor fue la atención, pero el tema de la organización dejó mucho que desear. Fuimos con niños por la mañana. Conviene ir con tiempo y sin prisa. Está bien para conocerlo una vez. Hay detalles que cambian bastante según la hora.","Puerto Vallarta, Jalisco, México",
Playa Camarones,playa,5,05/10/2025,"Quedé fascinado con Playa Camarones. La vista de la bahía se disfruta muchísimo. Además, en general, el tema de la organización marcó una diferencia positiva. Fuimos con amigos un domingo. El clima nos tocó a favor y eso mejoró todo. Me quedé con ganas de repetir. Nos quedamos con ganas de volver con más tiempo.","Puerto Vallarta, Jalisco, México",
Café del centro,café,2,17/12/2023,"Esperaba bastante más de Café del centro. No fue un buen descanso en medio del recorrido. Encima, el tema de la limpieza fue lo más flojo. Fuimos con mis papás de noche. El clima nos tocó a favor y eso mejoró todo. No sentí que el costo o el tiempo se justificaran. Esperaba una experiencia mucho más cuidada.","Puerto Vallarta, Jalisco, México",
Muelle de Los Muertos,atracción,4,25/01/2023,"En general nos fue bien en Muelle de Los Muertos. Fue una visita muy agradable. Además, en general, el tema de la atención estuvo muy bien. Fuimos en plan tranquilo un domingo. Entre semana se siente mucho más llevadero. Es una parada muy recomendable. Fue de esas visitas que te dejan buen sabor de boca.","Puerto Vallarta, Jalisco, México",
Sendero a Boca de Tomatlán,sendero,1,27/11/2023,"No recomiendo para nada Sendero a Boca de Tomatlán. Me dejó más agotado que satisfecho. Encima, el tema de los precios bajó bastante la experiencia. Fuimos en pareja por la mañana. En temporada alta imagino que cambia bastante. Hay mejores opciones en la zona. Esperaba una experiencia mucho más cuidada.","Puerto Vallarta, Jalisco, México",
Parroquia de Nuestra Señora de Guadalupe,iglesia,4,14/01/2025,"Muy buena experiencia en Parroquia de Nuestra Señora de Guadalupe. La arquitectura llama mucho la atención. Además, en general, el tema de la organización destacó bastante. Fuimos en familia al atardecer. Nos movimos a pie sin complicarnos. Sí regresaría. Fue de esas visitas que te dejan buen sabor de boca.","Puerto Vallarta, Jalisco, México",
Centro Histórico,barrio,5,27/01/2023,"De lo mejor del viaje fue Centro Histórico. Hay de todo a poca distancia. Además, honestamente, el tema de la tranquilidad me dejó muy buena impresión. Fuimos en plan tranquilo al atardecer. Entre semana se siente mucho más llevadero. Definitivamente volvería. Se nota cuando un lugar está bien llevado.","Puerto Vallarta, Jalisco, México",
Playa Colomitos,playa,4,13/12/2024,"Salimos contentos de Playa Colomitos. La arena estaba mejor de lo que esperaba. Además, la verdad, el tema de la atención marcó una diferencia positiva. Fuimos en pareja entre semana. El clima nos tocó a favor y eso mejoró todo. Lo volvería a incluir en otro viaje. Se nota cuando un lugar está bien llevado.","Puerto Vallarta, Jalisco, México",
Centro Histórico,barrio,1,26/10/2023,"Muy mala experiencia en Centro Histórico. No lo disfruté tanto como esperaba. Encima, el tema de la atención necesita mejorar. Fuimos en pareja de noche. El clima nos tocó a favor y eso mejoró todo. No sentí que el costo o el tiempo se justificaran. Me fui con la sensación de que pudo estar mucho mejor.","Puerto Vallarta, Jalisco, México",
Mercado de artesanías del Malecón,mercado,2,27/12/2025,"Esperaba bastante más de Mercado de artesanías del Malecón. La experiencia fue más cansada que entretenida. Encima, el tema de la limpieza estuvo por debajo de lo esperado. Fuimos en familia un domingo. Conviene ir con tiempo y sin prisa. Yo me lo saltaría la próxima vez. Hay mejores alternativas para aprovechar el día.","Puerto Vallarta, Jalisco, México",
Paseo por Marina al atardecer,paseo,4,14/12/2025,"Salimos contentos de Paseo por Marina al atardecer. La vista acompaña todo el recorrido. Además, la verdad, el tema del ambiente destacó bastante. Fuimos en familia al atardecer. En temporada alta imagino que cambia bastante. Sí regresaría. Fue de esas visitas que te dejan buen sabor de boca.","Puerto Vallarta, Jalisco, México",
Malecón de Puerto Vallarta,atracción,4,27/10/2025,"Buena visita a Malecón de Puerto Vallarta. Fue una visita muy agradable. Además, honestamente, el tema de la organización fue de lo mejor. Fuimos solo un domingo. El clima nos tocó a favor y eso mejoró todo. Sí regresaría. Incluso con gente, se pudo disfrutar bastante.","Puerto Vallarta, Jalisco, México",
Parque Lázaro Cárdenas,parque,4,13/12/2025,"Buena visita a Parque Lázaro Cárdenas. Es agradable para descansar un rato. Además, honestamente, el tema de la organización me dejó muy buena impresión. Fuimos con niños al mediodía. La zona alrededor tiene bastante movimiento. Es una parada muy recomendable. Fue de esas visitas que te dejan buen sabor de boca.","Puerto Vallarta, Jalisco, México",
Los Arcos de Mismaloya,tour,3,13/03/2024,"Ir a Los Arcos de Mismaloya cumplió, aunque esperaba un poco más. Cumple, pero no me sorprendió. Lo mejor fue la tranquilidad, pero el tema de la organización bajó bastante la experiencia. Fuimos en familia por la mañana. La zona alrededor tiene bastante movimiento. Tiene potencial si cuidan algunos detalles. La experiencia depende bastante del momento del día.","Puerto Vallarta, Jalisco, México",
Playa Colomitos,playa,4,16/05/2024,"Valió la pena conocer Playa Colomitos. El agua estaba agradable. Además, honestamente, el tema de la limpieza fue de lo mejor. Fuimos con niños al atardecer. Entre semana se siente mucho más llevadero. Lo recomiendo sin problema. Incluso con gente, se pudo disfrutar bastante.","Puerto Vallarta, Jalisco, México",
Zona Romántica,barrio,5,04/02/2024,"Excelente visita a Zona Romántica. Nos gustó recorrerlo a pie. Además, la verdad, el tema de la organización marcó una diferencia positiva. Fuimos en plan tranquilo un domingo. Entre semana se siente mucho más llevadero. Sí regresaría. Todo se sintió bastante cómodo.","Puerto Vallarta, Jalisco, México",
Centro Histórico,barrio,3,16/11/2024,"Mi visita a Centro Histórico estuvo bien, sin más. Se deja recorrer, pero no todo me gustó igual. Lo mejor fue la atención, pero el tema del mantenimiento dejó mucho que desear. Fuimos con mis papás entre semana. La zona alrededor tiene bastante movimiento. Tiene potencial si cuidan algunos detalles. Con unos ajustes podría mejorar muchísimo.","Puerto Vallarta, Jalisco, México",
Paseo en lancha al atardecer,tour,5,14/01/2024,"Excelente visita a Paseo en lancha al atardecer. No se sintió apresurado. Además, la verdad, el tema de la limpieza marcó una diferencia positiva. Fuimos con amigos al mediodía. Con calor fuerte conviene llevar agua y bloqueador. Definitivamente volvería. Todo se sintió bastante cómodo.","Puerto Vallarta, Jalisco, México",
Centro Histórico,barrio,5,09/06/2025,"Una gran sorpresa fue Centro Histórico. Nos gustó recorrerlo a pie. Además, en general, el tema del ambiente superó lo esperado. Fuimos con niños en vacaciones. Entre semana se siente mucho más llevadero. Me quedé con ganas de repetir. Todo se sintió bastante cómodo.","Puerto Vallarta, Jalisco, México",
Tour de snorkel en Los Arcos,tour,5,04/11/2025,"Volvería sin pensarlo a Tour de snorkel en Los Arcos. El guía explicó todo con claridad. Además, para mí, el tema de la relación calidad-precio sumó muchísimo. Fuimos solo de noche. Con calor fuerte conviene llevar agua y bloqueador. Vale mucho la pena. Se nota cuando un lugar está bien llevado.","Puerto Vallarta, Jalisco, México",
Playa Colomitos,playa,4,05/11/2023,"Muy buena experiencia en Playa Colomitos. Nos tocó una playa bastante disfrutable. Además, para mí, el tema de la atención superó lo esperado. Fuimos en familia en vacaciones. Entre semana se siente mucho más llevadero. Es una parada muy recomendable. Fue de esas visitas que te dejan buen sabor de boca.","Puerto Vallarta, Jalisco, México",
Sendero a Boca de Tomatlán,sendero,4,24/03/2024,"En general nos fue bien en Sendero a Boca de Tomatlán. Se disfruta más si vas con calma. Además, para mí, el tema de la ubicación sumó muchísimo. Fuimos solo entre semana. Conviene ir con tiempo y sin prisa. Lo volvería a incluir en otro viaje. Fue de esas visitas que te dejan buen sabor de boca.","Puerto Vallarta, Jalisco, México",
Playa Mismaloya,playa,2,07/01/2026,"Tuve una experiencia floja en Playa Mismaloya. Había demasiada gente para relajarse. Encima, el tema de la limpieza estuvo por debajo de lo esperado. Fuimos con niños un domingo. Con calor fuerte conviene llevar agua y bloqueador. Hay mejores opciones en la zona. Hay mejores alternativas para aprovechar el día.","Puerto Vallarta, Jalisco, México",
Paseo en lancha al atardecer,tour,5,20/07/2024,"Excelente visita a Paseo en lancha al atardecer. El guía explicó todo con claridad. Además, en general, el tema de la relación calidad-precio estuvo muy bien. Fuimos solo entre semana. Hay buenos puntos para tomar fotos. Es una parada muy recomendable. Se nota cuando un lugar está bien llevado.","Puerto Vallarta, Jalisco, México",
Mercado del mar,mercado,5,23/10/2023,"Volvería sin pensarlo a Mercado del mar. Hay mucha variedad para curiosear. Además, honestamente, el tema de la organización sumó muchísimo. Fuimos en pareja entre semana. Fuimos temprano y se disfrutó más. Lo recomiendo sin problema. Se nota cuando un lugar está bien llevado.","Puerto Vallarta, Jalisco, México",
Café del centro,café,5,02/10/2023,"Una gran sorpresa fue Café del centro. El ambiente invita a quedarse. Además, en general, el tema de la organización estuvo muy bien. Fuimos con amigos por la mañana. Entre semana se siente mucho más llevadero. Es una parada muy recomendable. Todo se sintió bastante cómodo.","Puerto Vallarta, Jalisco, México",
Zona Romántica,barrio,3,14/02/2023,"La experiencia en Zona Romántica fue regular. Está bien, sobre todo si te queda de paso. Lo mejor fue la experiencia general, pero el tema de los precios dejó mucho que desear. Fuimos con mis papás en vacaciones. Nos movimos a pie sin complicarnos. Puede gustarte más si eliges bien la hora. Con unos ajustes podría mejorar muchísimo.","Puerto Vallarta, Jalisco, México",
Marina Vallarta,paseo,3,09/05/2025,"La vuelta por Marina Vallarta fue bastante normal. Es agradable, aunque no siempre igual de cómodo. Lo mejor fue el ambiente, pero el tema de la saturación de gente fue lo más flojo. Fuimos con amigos un domingo. En temporada alta imagino que cambia bastante. No me arrepiento de haber ido. No fue perfecto, pero sí tuvo momentos rescatables.","Puerto Vallarta, Jalisco, México",
Jardín Botánico de Vallarta,jardín,2,23/04/2025,"No terminé convencido con Jardín Botánico de Vallarta. No encontré tanto valor como esperaba. Encima, el tema de los precios dejó mucho que desear. Fuimos en plan tranquilo al atardecer. Fuimos temprano y se disfrutó más. No volvería así como está. No sentí que el tiempo invertido valiera la pena.","Puerto Vallarta, Jalisco, México",
Parque Lázaro Cárdenas,parque,2,28/10/2023,"Salí medio decepcionado de Parque Lázaro Cárdenas. No me dio ganas de pasar más tiempo ahí. Encima, el tema de la atención necesita mejorar. Fuimos en plan tranquilo en vacaciones. En temporada alta imagino que cambia bastante. Hay mejores opciones en la zona. Esperaba una experiencia mucho más cuidada.","Puerto Vallarta, Jalisco, México",
Restaurante frente al mar en Marina,restaurante,5,12/08/2023,"Una gran sorpresa fue Restaurante frente al mar en Marina. La atención fue rápida y amable. Además, honestamente, el tema de la experiencia general estuvo muy bien. Fuimos con niños entre semana. Conviene ir con tiempo y sin prisa. Me quedé con ganas de repetir. Incluso con gente, se pudo disfrutar bastante.","Puerto Vallarta, Jalisco, México",
Plaza de Armas,plaza,3,31/12/2025,"Pasar por Plaza de Armas tuvo cosas buenas y otras mejorables. La visita fue correcta, sin gran sorpresa. Lo mejor fue la experiencia general, pero el tema de la organización necesita mejorar. Fuimos con niños por la mañana. Llegamos al atardecer y la luz ayudó muchísimo. Está bien para conocerlo una vez. Con unos ajustes podría mejorar muchísimo.","Puerto Vallarta, Jalisco, México",
Playa Conchas Chinas,playa,2,19/03/2023,"La visita a Playa Conchas Chinas me dejó dudas. La experiencia fue incómoda casi todo el tiempo. Encima, el tema de la señalización estuvo por debajo de lo esperado. Fuimos con mis papás al mediodía. Con calor fuerte conviene llevar agua y bloqueador. Hay mejores opciones en la zona. Me fui con la sensación de que pudo estar mucho mejor.","Puerto Vallarta, Jalisco, México",
Paseo en lancha al atardecer,tour,2,27/07/2024,"La visita a Paseo en lancha al atardecer me dejó dudas. El tour se sintió desordenado. Encima, el tema de la organización necesita mejorar. Fuimos con amigos por la mañana. La zona alrededor tiene bastante movimiento. Con varios cambios podría mejorar, pero hoy no lo recomendaría. No sentí que el tiempo invertido valiera la pena.","Puerto Vallarta, Jalisco, México",
Mismaloya,playa,4,18/10/2025,"Salimos contentos de Mismaloya. Nos tocó una playa bastante disfrutable. Además, la verdad, el tema de la ubicación superó lo esperado. Fuimos solo un domingo. Llegamos al atardecer y la luz ayudó muchísimo. Es una parada muy recomendable. Se nota cuando un lugar está bien llevado.","Puerto Vallarta, Jalisco, México",
Resort frente a la playa,hotel,4,23/01/2025,"Nos gustó bastante Resort frente a la playa. El check-in fue rápido y amable. Además, para mí, el tema de la relación calidad-precio estuvo muy bien. Fuimos en plan tranquilo al atardecer. Fuimos temprano y se disfrutó más. Me quedé con ganas de repetir. Todo se sintió bastante cómodo.","Puerto Vallarta, Jalisco, México",
Muelle de Los Muertos,atracción,4,10/02/2023,"En general nos fue bien en Muelle de Los Muertos. Se disfruta sin necesidad de hacer gran plan. Además, en general, el tema de la organización sumó muchísimo. Fuimos en pareja al mediodía. Con calor fuerte conviene llevar agua y bloqueador. Me quedé con ganas de repetir. Incluso con gente, se pudo disfrutar bastante.","Puerto Vallarta, Jalisco, México",
Restaurante frente al mar en Marina,restaurante,4,20/06/2024,"Salimos contentos de Restaurante frente al mar en Marina. La vista suma bastante a la experiencia. Además, la verdad, el tema del servicio marcó una diferencia positiva. Fuimos en familia entre semana. En temporada alta imagino que cambia bastante. Lo volvería a incluir en otro viaje. Todo se sintió bastante cómodo.","Puerto Vallarta, Jalisco, México",
Centro Histórico,barrio,4,09/09/2024,"En general nos fue bien en Centro Histórico. Nos gustó recorrerlo a pie. Además, la verdad, el tema de la organización destacó bastante. Fuimos con mis papás entre semana. Nos movimos a pie sin complicarnos. Definitivamente volvería. Incluso con gente, se pudo disfrutar bastante.","Puerto Vallarta, Jalisco, México",
Los Arcos de Mismaloya,tour,4,29/07/2025,"Salimos contentos de Los Arcos de Mismaloya. La actividad estuvo muy bien llevada. Además, en general, el tema de la experiencia general superó lo esperado. Fuimos con mis papás al atardecer. El clima nos tocó a favor y eso mejoró todo. Definitivamente volvería. Incluso con gente, se pudo disfrutar bastante.","Puerto Vallarta, Jalisco, México",
Paseo en lancha al atardecer,tour,5,20/03/2023,"Una gran sorpresa fue Paseo en lancha al atardecer. El guía explicó todo con claridad. Además, para mí, el tema de la organización destacó bastante. Fuimos en plan tranquilo al mediodía. Fuimos temprano y se disfrutó más. Definitivamente volvería. Todo se sintió bastante cómodo.","Puerto Vallarta, Jalisco, México",
