place_name,place_category,rating,review_date,review_text,city_target,
Café del centro,café,4,17/06/2023,"Buena visita a Café del centro. Es buen sitio para descansar un rato. Además, honestamente, el tema de la organización destacó bastante. Fuimos en plan tranquilo por la mañana. Llegamos al atardecer y la luz ayudó muchísimo. Es una parada muy recomendable. Fue de esas visitas que te dejan buen sabor de boca.","Puerto Vallarta, Jalisco, México",
Café del centro,café,1,30/12/2025,"La peor parte del viaje fue Café del centro. La visita terminó siendo más incómoda de lo esperado. Encima, el tema de la limpieza dejó mucho que desear. Fuimos en plan tranquilo al mediodía. La zona alrededor tiene bastante movimiento. No volvería así como está. Hay mejores alternativas para aprovechar el día.","Puerto Vallarta, Jalisco, México",
Café del centro,café,5,22/05/2024,"Me encantó Café del centro. El ambiente invita a quedarse. Además, la verdad, el tema de la tranquilidad me dejó muy buena impresión. Fuimos solo entre semana. Fuimos temprano y se disfrutó más. Sí regresaría. Se nota cuando un lugar está bien llevado.","Puerto Vallarta, Jalisco, México",
Plaza de Armas,plaza,4,26/12/2025,"Nos gustó bastante Plaza de Armas. Es agradable para sentarse un rato. Además, en general, el tema del ambiente marcó una diferencia positiva. Fuimos en familia un domingo. La zona alrededor tiene bastante movimiento. Me quedé con ganas de repetir. Todo se sintió bastante cómodo.","Puerto Vallarta, Jalisco, México",
Paseo en lancha al atardecer,tour,2,22/08/2023,"Salí medio decepcionado de Paseo en lancha al atardecer. Parecía que nadie coordinaba bien la actividad. Encima, el tema de la organización terminó siendo un problema. Fuimos en pareja de noche. Hay buenos puntos para tomar fotos. Con varios cambios podría mejorar, pero hoy no lo recomendaría. Esperaba una experiencia mucho más cuidada.","Puerto Vallarta, Jalisco, México",
Playa Conchas Chinas,playa,4,16/01/2023,"En general nos fue bien en Playa Conchas Chinas. La vista de la bahía se disfruta muchísimo. Además, en general, el tema de la relación calidad-precio destacó bastante. Fuimos con mis papás en vacaciones. Llegamos al atardecer y la luz ayudó muchísimo. Sí regresaría. Incluso con gente, se pudo disfrutar bastante.","Puerto Vallarta, Jalisco, México",
Playa Colomitos,playa,4,07/09/2025,"Muy buena experiencia en Playa Colomitos. La arena estaba mejor de lo que esperaba. Además, honestamente, el tema de la organización destacó bastante. Fuimos solo entre semana. Conviene ir con tiempo y sin prisa. Definitivamente volvería. Nos quedamos con ganas de volver con más tiempo.","Puerto Vallarta, Jalisco, México",
Avistamiento de ballenas,tour,5,02/08/2023,"Me encantó Avistamiento de ballenas. No se sintió apresurado. Además, la verdad, el tema del ambiente fue de lo mejor. Fuimos en pareja al atardecer. La zona alrededor tiene bastante movimiento. Lo recomiendo sin problema. Nos quedamos con ganas de volver con más tiempo.","Puerto Vallarta, Jalisco, México",
Mismaloya,playa,3,07/06/2023,"Conocer Mismaloya estuvo correcto, pero no me sorprendió. Se deja disfrutar, pero con expectativas moderadas. Lo mejor fue la tranquilidad, pero el tema de los precios estuvo por debajo de lo esperado. Fuimos solo al atardecer. Fuimos temprano y se disfrutó más. Puede gustarte más si eliges bien la hora. Con unos ajustes podría mejorar muchísimo.","Puerto Vallarta, Jalisco, México",
Avistamiento de ballenas,tour,5,14/06/2024,"Excelente visita a Avistamiento de ballenas. La actividad estuvo muy bien llevada. Además, para mí, el tema de la tranquilidad sumó muchísimo. Fuimos con amigos al mediodía. Hay buenos puntos para tomar fotos. Es una parada muy recomendable. Se nota cuando un lugar está bien llevado.","Puerto Vallarta, Jalisco, México",
Parque Lázaro Cárdenas,parque,4,24/10/2023,"Buena visita a Parque Lázaro Cárdenas. Nos gustó para hacer una pausa. Además, en general, el tema del ambiente superó lo esperado. Fuimos con mis papás en vacaciones. El clima nos tocó a favor y eso mejoró todo. Es una parada muy recomendable. Incluso con gente, se pudo disfrutar bastante.","Puerto Vallarta, Jalisco, México",
Zona Romántica,barrio,5,11/06/2024,"Excelente visita a Zona Romántica. Se siente muy vivo. Además, la verdad, el tema del ambiente me dejó muy buena impresión. Fuimos en pareja un domingo. Fuimos temprano y se disfrutó más. Me quedé con ganas de repetir. Se nota cuando un lugar está bien llevado.","Puerto Vallarta, Jalisco, México",
Tour de snorkel en Los Arcos,tour,4,07/09/2023,"En general nos fue bien en Tour de snorkel en Los Arcos. La actividad estuvo muy bien llevada. Además, en general, el tema de la atención fue de lo mejor. Fuimos en plan tranquilo al atardecer. La zona alrededor tiene bastante movimiento. Lo volvería a incluir en otro viaje. Fue de esas visitas que te dejan buen sabor de boca.","Puerto Vallarta, Jalisco, México",
Tour gastronómico por el centro,tour,2,04/04/2025,"La visita a Tour gastronómico por el centro me dejó dudas. Parecía que nadie coordinaba bien la actividad. Encima, el tema de la limpieza se notó bastante. Fuimos en plan tranquilo por la mañana. Fuimos temprano y se disfrutó más. Hay mejores opciones en la zona. La fama del lugar me hizo esperar bastante más.","Puerto Vallarta, Jalisco, México",
Los Arcos de Mismaloya,tour,5,01/07/2025,"De lo mejor del viaje fue Los Arcos de Mismaloya. El recorrido estuvo bien armado. Además, en general, el tema de la limpieza me dejó muy buena impresión. Fuimos con mis papás por la mañana. Fuimos temprano y se disfrutó más. Es una parada muy recomendable. Se nota cuando un lugar está bien llevado.","Puerto Vallarta, Jalisco, México",
Mismaloya,playa,5,31/03/2026,"De lo mejor del viaje fue Mismaloya. La arena estaba mejor de lo que esperaba. Además, honestamente, el tema del servicio estuvo muy bien. Fuimos con niños entre semana. Conviene ir con tiempo y sin prisa. Definitivamente volvería. Incluso con gente, se pudo disfrutar bastante.","Puerto Vallarta, Jalisco, México",
Malecón de Puerto Vallarta,atracción,5,15/10/2025,"Una gran sorpresa fue Malecón de Puerto Vallarta. Fue una visita muy agradable. Además, la verdad, el tema de la atención sumó muchísimo. Fuimos solo de noche. Hay buenos puntos para tomar fotos. Definitivamente volvería. Nos quedamos con ganas de volver con más tiempo.","Puerto Vallarta, Jalisco, México",
Paseo en barco por la bahía,tour,2,06/01/2025,"Esperaba bastante más de Paseo en barco por la bahía. La logística fue mala desdel inicio. Encima, el tema de la limpieza dejó mucho que desear. Fuimos en plan tranquilo por la mañana. Fuimos temprano y se disfrutó más. Hay mejores opciones en la zona. La fama del lugar me hizo esperar bastante más.","Puerto Vallarta, Jalisco, México",
Restaurante frente al mar en Marina,restaurante,5,19/08/2024,"De lo mejor del viaje fue Restaurante frente al mar en Marina. La comida salió muy bien. Además, honestamente, el tema de la vista destacó bastante. Fuimos con amigos entre semana. Llegamos al atardecer y la luz ayudó muchísimo. Vale mucho la pena. Se nota cuando un lugar está bien llevado.","Puerto Vallarta, Jalisco, México",
Mercado Municipal Río Cuale,mercado,3,04/10/2024,"Mi visita a Mercado Municipal Río Cuale estuvo bien, sin más. Hay algunos puestos interesantes y otros muy normales. Lo mejor fue la experiencia general, pero el tema de los precios terminó siendo un problema. Fuimos con amigos al mediodía. Llegamos al atardecer y la luz ayudó muchísimo. Está bien para conocerlo una vez. Hay detalles que cambian bastante según la hora.","Puerto Vallarta, Jalisco, México",
Isla del Río Cuale,parque,1,19/03/2024,"Fue una decepción total visitar Isla del Río Cuale. No me dio ganas de pasar más tiempo ahí. Encima, el tema del acceso necesita mejorar. Fuimos con niños en vacaciones. Llegamos al atardecer y la luz ayudó muchísimo. No volvería así como está. Hay mejores alternativas para aprovechar el día.","Puerto Vallarta, Jalisco, México",
Mercado de artesanías del Malecón,mercado,4,18/05/2024,"Muy buena experiencia en Mercado de artesanías del Malecón. El ambiente es muy auténtico. Además, la verdad, el tema de la organización marcó una diferencia positiva. Fuimos solo por la mañana. Entre semana se siente mucho más llevadero. Lo recomiendo sin problema. Se nota cuando un lugar está bien llevado.","Puerto Vallarta, Jalisco, México",
Los Arcos de Mismaloya,tour,5,03/09/2025,"Volvería sin pensarlo a Los Arcos de Mismaloya. El guía explicó todo con claridad. Además, en general, el tema de la experiencia general marcó una diferencia positiva. Fuimos en pareja al atardecer. El clima nos tocó a favor y eso mejoró todo. Vale mucho la pena. Nos quedamos con ganas de volver con más tiempo.","Puerto Vallarta, Jalisco, México",
Mismaloya,playa,3,27/05/2023,"Ir a Mismaloya cumplió, aunque esperaba un poco más. Tiene ratos agradables, aunque depende mucho de la hora. Lo mejor fue la atención, pero el tema del tiempo de espera dejó mucho que desear. Fuimos en familia en vacaciones. Conviene ir con tiempo y sin prisa. No me arrepiento de haber ido. Con unos ajustes podría mejorar muchísimo.","Puerto Vallarta, Jalisco, México",
Mercado Municipal Río Cuale,mercado,5,27/07/2025,"Excelente visita a Mercado Municipal Río Cuale. Vale la pena caminarlo con calma. Además, para mí, el tema de la ubicación marcó una diferencia positiva. Fuimos en plan tranquilo de noche. Con calor fuerte conviene llevar agua y bloqueador. Lo volvería a incluir en otro viaje. Se nota cuando un lugar está bien llevado.","Puerto Vallarta, Jalisco, México",
Paseo en barco por la bahía,tour,2,25/08/2025,"Paseo en barco por la bahía no me terminó de convencer. Parecía que nadie coordinaba bien la actividad. Encima, el tema de la atención necesita mejorar. Fuimos en plan tranquilo por la mañana. La zona alrededor tiene bastante movimiento. No volvería así como está. Me fui con la sensación de que pudo estar mucho mejor.","Puerto Vallarta, Jalisco, México",
Mismaloya,playa,2,10/05/2023,"Esperaba bastante más de Mismaloya. No estuvo a la altura de lo que prometía. Encima, el tema de la limpieza bajó bastante la experiencia. Fuimos solo un domingo. Conviene ir con tiempo y sin prisa. Yo me lo saltaría la próxima vez. Hay mejores alternativas para aprovechar el día.","Puerto Vallarta, Jalisco, México",
Tour a Yelapa,tour,4,28/07/2025,"Valió la pena conocer Tour a Yelapa. El guía explicó todo con claridad. Además, la verdad, el tema de la relación calidad-precio estuvo muy bien. Fuimos en plan tranquilo por la mañana. Nos movimos a pie sin complicarnos. Es una parada muy recomendable. Todo se sintió bastante cómodo.","Puerto Vallarta, Jalisco, México",
Café del centro,café,1,11/09/2023,"Salí muy inconforme de Café del centro. La experiencia se sintió descuidada. Encima, el tema del ruido necesita mejorar. Fuimos en pareja al mediodía. Conviene ir con tiempo y sin prisa. No volvería así como está. No sentí que el tiempo invertido valiera la pena.","Puerto Vallarta, Jalisco, México",
Tour de snorkel en Los Arcos,tour,5,05/12/2025,"Una gran sorpresa fue Tour de snorkel en Los Arcos. La logística salió mejor de lo esperado. Además, honestamente, el tema de la atención fue de lo mejor. Fuimos con amigos al atardecer. Hay buenos puntos para tomar fotos. Vale mucho la pena. Todo se sintió bastante cómodo.","Puerto Vallarta, Jalisco, México",
Paseo en barco por la bahía,tour,3,15/09/2023,"Pasar por Paseo en barco por la bahía tuvo cosas buenas y otras mejorables. La idea del tour es buena, pero le faltan detalles. Lo mejor fue la atención, pero el tema de los precios dejó mucho que desear. Fuimos en familia en vacaciones. En temporada alta imagino que cambia bastante. No fue espectacular, pero tampoco un desperdicio. No fue perfecto, pero sí tuvo momentos rescatables.","Puerto Vallarta, Jalisco, México",
Galería de arte local,galería,5,03/03/2025,"Quedé fascinado con Galería de arte local. Se nota trabajo de artistas locales. Además, en general, el tema de la organización destacó bastante. Fuimos solo de noche. Fuimos temprano y se disfrutó más. Me quedé con ganas de repetir. Incluso con gente, se pudo disfrutar bastante.","Puerto Vallarta, Jalisco, México",
Playa Colomitos,playa,2,06/12/2025,"Tuve una experiencia floja en Playa Colomitos. La experiencia fue incómoda casi todo el tiempo. Encima, el tema del mantenimiento bajó bastante la experiencia. Fuimos en pareja de noche. Nos movimos a pie sin complicarnos. Yo me lo saltaría la próxima vez. Esperaba una experiencia mucho más cuidada.","Puerto Vallarta, Jalisco, México",
Hotel boutique en Zona Romántica,hotel,5,08/07/2023,"De lo mejor del viaje fue Hotel boutique en Zona Romántica. La habitación estaba cómoda. Además, honestamente, el tema de la relación calidad-precio sumó muchísimo. Fuimos con amigos por la mañana. Hay buenos puntos para tomar fotos. Lo volvería a incluir en otro viaje. Todo se sintió bastante cómodo.","Puerto Vallarta, Jalisco, México",
Resort frente a la playa,hotel,1,20/01/2023,"Fue una decepción total visitar Resort frente a la playa. El descanso fue malo. Encima, el tema de la saturación de gente terminó siendo un problema. Fuimos en familia al atardecer. Con calor fuerte conviene llevar agua y bloqueador. No sentí que el costo o el tiempo se justificaran. Esperaba una experiencia mucho más cuidada.","Puerto Vallarta, Jalisco, México",
Zona Romántica,barrio,4,16/04/2024,"Nos gustó bastante Zona Romántica. Es de las zonas con más ambiente. Además, para mí, el tema del ambiente me dejó muy buena impresión. Fuimos con amigos al mediodía. En temporada alta imagino que cambia bastante. Sí regresaría. Nos quedamos con ganas de volver con más tiempo.","Puerto Vallarta, Jalisco, México",
Playa Camarones,playa,5,17/11/2025,"Volvería sin pensarlo a Playa Camarones. La arena estaba mejor de lo que esperaba. Además, la verdad, el tema de la ubicación superó lo esperado. Fuimos con amigos al mediodía. Fuimos temprano y se disfrutó más. Vale mucho la pena. Todo se sintió bastante cómodo.","Puerto Vallarta, Jalisco, México",
Tour gastronómico por el centro,tour,4,12/12/2023,"Valió la pena conocer Tour gastronómico por el centro. La logística salió mejor de lo esperado. Además, en general, el tema de la tranquilidad sumó muchísimo. Fuimos con mis papás un domingo. El clima nos tocó a favor y eso mejoró todo. Es una parada muy recomendable. Fue de esas visitas que te dejan buen sabor de boca.","Puerto Vallarta, Jalisco, México",
Excursión a las cascadas,tour,4,04/05/2025,"Buena visita a Excursión a las cascadas. No se sintió apresurado. Además, en general, el tema de la tranquilidad marcó una diferencia positiva. Fuimos en plan tranquilo al mediodía. La zona alrededor tiene bastante movimiento. Lo recomiendo sin problema. Incluso con gente, se pudo disfrutar bastante.","Puerto Vallarta, Jalisco, México",
Tour en cuatrimoto,tour,3,18/11/2023,"La vuelta por Tour en cuatrimoto fue bastante normal. Hubo partes entretenidas y otras flojas. Lo mejor fue el ambiente, pero el tema del tiempo de espera estuvo por debajo de lo esperado. Fuimos con amigos en vacaciones. Llegamos al atardecer y la luz ayudó muchísimo. No me arrepiento de haber ido. Se disfruta más si vas con expectativas realistas.","Puerto Vallarta, Jalisco, México",
Zona Romántica,barrio,1,12/02/2025,"Fue una decepción total visitar Zona Romántica. Lo sentí demasiado saturado. Encima, el tema de la organización se notó bastante. Fuimos con mis papás por la mañana. El clima nos tocó a favor y eso mejoró todo. No volvería así como está. Me fui con la sensación de que pudo estar mucho mejor.","Puerto Vallarta, Jalisco, México",
Café del centro,café,4,05/08/2024,"En general nos fue bien en Café del centro. Es buen sitio para descansar un rato. Además, en general, el tema del ambiente destacó bastante. Fuimos con mis papás de noche. Entre semana se siente mucho más llevadero. Sí regresaría. Se nota cuando un lugar está bien llevado.","Puerto Vallarta, Jalisco, México",
Isla del Río Cuale,parque,3,31/01/2026,"La experiencia en Isla del Río Cuale fue regular. Cumple como pausa en el recorrido. Lo mejor fue la organización, pero el tema de la atención fue lo más flojo. Fuimos en plan tranquilo un domingo. El clima nos tocó a favor y eso mejoró todo. No me arrepiento de haber ido. Se disfruta más si vas con expectativas realistas.","Puerto Vallarta, Jalisco, México",
Playa Colomitos,playa,1,03/03/2024,"Fue una decepción total visitar Playa Colomitos. La experiencia fue incómoda casi todo el tiempo. Encima, el tema del ruido bajó bastante la experiencia. Fuimos en plan tranquilo por la mañana. El clima nos tocó a favor y eso mejoró todo. No volvería así como está. Esperaba una experiencia mucho más cuidada.","Puerto Vallarta, Jalisco, México",
Café del centro,café,2,26/10/2024,"La visita a Café del centro me dejó dudas. La experiencia se sintió descuidada. Encima, el tema del acceso terminó siendo un problema. Fuimos con niños al atardecer. Fuimos temprano y se disfrutó más. Hay mejores opciones en la zona. Hay mejores alternativas para aprovechar el día.","Puerto Vallarta, Jalisco, México",
Galería de arte local,galería,1,02/01/2023,"La peor parte del viaje fue Galería de arte local. No sentí una curaduría especialmente cuidada. Encima, el tema de la limpieza fue lo más flojo. Fuimos con niños en vacaciones. Conviene ir con tiempo y sin prisa. Yo me lo saltaría la próxima vez. Me fui con la sensación de que pudo estar mucho mejor.","Puerto Vallarta, Jalisco, México",
Isla del Río Cuale,parque,3,16/07/2024,"Pasar por Isla del Río Cuale tuvo cosas buenas y otras mejorables. Cumple como pausa en el recorrido. Lo mejor fue la limpieza, pero el tema de los precios fue lo más flojo. Fuimos solo al atardecer. Entre semana se siente mucho más llevadero. Puede gustarte más si eliges bien la hora. La experiencia depende bastante del momento del día.","Puerto Vallarta, Jalisco, México",
Parroquia de Nuestra Señora de Guadalupe,iglesia,5,08/10/2023,"De lo mejor del viaje fue Parroquia de Nuestra Señora de Guadalupe. Por dentro luce muy bonita. Además, la verdad, el tema de la experiencia general marcó una diferencia positiva. Fuimos en familia al mediodía. La zona alrededor tiene bastante movimiento. Me quedé con ganas de repetir. Fue de esas visitas que te dejan buen sabor de boca.","Puerto Vallarta, Jalisco, México",
Plaza de Armas,plaza,4,03/08/2023,"En general nos fue bien en Plaza de Armas. Siempre hay algo que ver. Además, la verdad, el tema de la tranquilidad sumó muchísimo. Fuimos con amigos un domingo. El clima nos tocó a favor y eso mejoró todo. Sí regresaría. Fue de esas visitas que te dejan buen sabor de boca.","Puerto Vallarta, Jalisco, México",
Paseo en barco por la bahía,tour,5,09/09/2025,"Me encantó Paseo en barco por la bahía. El recorrido estuvo bien armado. Además, honestamente, el tema de la tranquilidad marcó una diferencia positiva. Fuimos en plan tranquilo al atardecer. Con calor fuerte conviene llevar agua y bloqueador. Es una parada muy recomendable. Nos quedamos con ganas de volver con más tiempo.","Puerto Vallarta, Jalisco, México",
Paseo en barco por la bahía,tour,5,17/02/2025,"Quedé fascinado con Paseo en barco por la bahía. El recorrido estuvo bien armado. Además, en general, el tema de la limpieza destacó bastante. Fuimos con amigos al atardecer. Llegamos al atardecer y la luz ayudó muchísimo. Definitivamente volvería. Todo se sintió bastante cómodo.","Puerto Vallarta, Jalisco, México",
Zona Romántica,barrio,4,08/10/2023,"Valió la pena conocer Zona Romántica. Es de las zonas con más ambiente. Además, honestamente, el tema de la atención me dejó muy buena impresión. Fuimos en pareja al mediodía. Entre semana se siente mucho más llevadero. Lo recomiendo sin problema. Todo se sintió bastante cómodo.","Puerto Vallarta, Jalisco, México",
Tour de tacos y mariscos,tour,1,07/09/2023,"Fue una decepción total visitar Tour de tacos y mariscos. El tour se sintió desordenado. Encima, el tema de los precios estuvo por debajo de lo esperado. Fuimos con amigos de noche. Entre semana se siente mucho más llevadero. Hay mejores opciones en la zona. Me fui con la sensación de que pudo estar mucho mejor.","Puerto Vallarta, Jalisco, México",
Malecón de Puerto Vallarta,atracción,3,06/02/2026,"La experiencia en Malecón de Puerto Vallarta fue regular. No estuvo mal, solo más normal de lo que imaginaba. Lo mejor fue la experiencia general, pero el tema de la saturación de gente dejó mucho que desear. Fuimos en pareja de noche. En temporada alta imagino que cambia bastante. Tiene potencial si cuidan algunos detalles. Se disfruta más si vas con expectativas realistas.","Puerto Vallarta, Jalisco, México",
Parroquia de Nuestra Señora de Guadalupe,iglesia,1,11/03/2026,"Fue una decepción total visitar Parroquia de Nuestra Señora de Guadalupe. Había demasiada gente para apreciarla bien. Encima, el tema de la saturación de gente estuvo por debajo de lo esperado. Fuimos en pareja al atardecer. Hay buenos puntos para tomar fotos. Yo me lo saltaría la próxima vez. Esperaba una experiencia mucho más cuidada.","Puerto Vallarta, Jalisco, México",
Paseo en lancha al atardecer,tour,3,07/01/2023,"Ir a Paseo en lancha al atardecer cumplió, aunque esperaba un poco más. Cumple, pero no me sorprendió. Lo mejor fue el ambiente, pero el tema de la limpieza necesita mejorar. Fuimos en plan tranquilo por la mañana. En temporada alta imagino que cambia bastante. Está bien para conocerlo una vez. Se disfruta más si vas con expectativas realistas.","Puerto Vallarta, Jalisco, México",
Plaza de Armas,plaza,5,23/09/2023,"Quedé fascinado con Plaza de Armas. Tiene buen ambiente local. Además, honestamente, el tema de la organización me dejó muy buena impresión. Fuimos solo un domingo. Entre semana se siente mucho más llevadero. Lo volvería a incluir en otro viaje. Nos quedamos con ganas de volver con más tiempo.","Puerto Vallarta, Jalisco, México",
Plaza de Armas,plaza,5,14/08/2023,"Quedé fascinado con Plaza de Armas. Tiene buen ambiente local. Además, honestamente, el tema de la organización fue de lo mejor. Fuimos con amigos en vacaciones. Nos movimos a pie sin complicarnos. Sí regresaría. Fue de esas visitas que te dejan buen sabor de boca.","Puerto Vallarta, Jalisco, México",
Jardín Botánico de Vallarta,jardín,1,11/01/2024,"La peor parte del viaje fue Jardín Botánico de Vallarta. No encontré tanto valor como esperaba. Encima, el tema de los precios necesita mejorar. Fuimos con niños al mediodía. Conviene ir con tiempo y sin prisa. Con varios cambios podría mejorar, pero hoy no lo recomendaría. La fama del lugar me hizo esperar bastante más.","Puerto Vallarta, Jalisco, México",
Tour de tacos y mariscos,tour,1,16/10/2025,"Salí muy inconforme de Tour de tacos y mariscos. El tour se sintió desordenado. Encima, el tema de la organización fue lo más flojo. Fuimos en familia en vacaciones. Hay buenos puntos para tomar fotos. No sentí que el costo o el tiempo se justificaran. Esperaba una experiencia mucho más cuidada.","Puerto Vallarta, Jalisco, México",
Galería del Centro,galería,5,31/10/2023,"De lo mejor del viaje fue Galería del Centro. Fue una parada cultural muy disfrutable. Además, para mí, el tema de la relación calidad-precio marcó una diferencia positiva. Fuimos en pareja un domingo. Con calor fuerte conviene llevar agua y bloqueador. Definitivamente volvería. Fue de esas visitas que te dejan buen sabor de boca.","Puerto Vallarta, Jalisco, México",
Playa Colomitos,playa,4,31/01/2023,"Valió la pena conocer Playa Colomitos. La vista de la bahía se disfruta muchísimo. Además, para mí, el tema de la experiencia general me dejó muy buena impresión. Fuimos en familia en vacaciones. Hay buenos puntos para tomar fotos. Vale mucho la pena. Incluso con gente, se pudo disfrutar bastante.","Puerto Vallarta, Jalisco, México",
Tour gastronómico por el centro,tour,5,24/08/2023,"Quedé fascinado con Tour gastronómico por el centro. La logística salió mejor de lo esperado. Además, en general, el tema de la ubicación estuvo muy bien. Fuimos solo al mediodía. Con calor fuerte conviene llevar agua y bloqueador. Me quedé con ganas de repetir. Fue de esas visitas que te dejan buen sabor de boca.","Puerto Vallarta, Jalisco, México",
Tour de tacos y mariscos,tour,3,06/12/2025,"Pasar por Tour de tacos y mariscos tuvo cosas buenas y otras mejorables. La idea del tour es buena, pero le faltan detalles. Lo mejor fue la organización, pero el tema del ruido necesita mejorar. Fuimos en plan tranquilo un domingo. Conviene ir con tiempo y sin prisa. No me arrepiento de haber ido. Se disfruta más si vas con expectativas realistas.","Puerto Vallarta, Jalisco, México",
Mercado Municipal Río Cuale,mercado,4,19/05/2025,"Muy buena experiencia en Mercado Municipal Río Cuale. Vale la pena caminarlo con calma. Además, honestamente, el tema de la tranquilidad sumó muchísimo. Fuimos solo entre semana. Hay buenos puntos para tomar fotos. Me quedé con ganas de repetir. Incluso con gente, se pudo disfrutar bastante.","Puerto Vallarta, Jalisco, México",
